{
  "storyId": "story-sunbell-grove",
  "version": 1,
  "passageId": "G1",
  "locations": [
    {
      "id": "sunbell-glade",
      "name": "The sunlit Sunbell glade",
      "bounds": [52, 10, 62],
      "environment": {
        "floorColor": "#65784a",
        "wallColor": "#49613f",
        "ambientColor": "#e6e5bc"
      }
    }
  ],
  "entities": [
    {
      "id": "grove-bench-1",
      "name": "Blue-painted woodland bench",
      "kind": "bench",
      "locationId": "sunbell-glade",
      "assetKey": "courtyard-bench",
      "dimensions": [3.1, 1.3, 1.45],
      "transform": { "position": [-3.8, 0.65, -1.4], "rotation": [0, 0.24, 0] },
      "provenance": { "passageId": "G1", "confidence": 0.95 }
    },
    {
      "id": "grove-lantern-1",
      "name": "Unlit pilgrim lantern",
      "kind": "light",
      "locationId": "sunbell-glade",
      "assetKey": "lantern",
      "state": { "lit": false },
      "provenance": { "passageId": "G1", "confidence": 0.96 }
    },
    {
      "id": "singing-stone-1",
      "name": "Lichen-soft singing stone",
      "kind": "rock",
      "locationId": "sunbell-glade",
      "assetKey": "environment-rock",
      "dimensions": [1.8, 1.05, 1.45],
      "transform": { "position": [4.6, 0.525, -4.8], "rotation": [0, -0.35, 0] },
      "provenance": { "passageId": "G1", "confidence": 0.92 }
    },
    {
      "id": "traveller-crate-1",
      "name": "Small traveller's provision box",
      "kind": "container",
      "locationId": "sunbell-glade",
      "assetKey": "crate",
      "dimensions": [1.15, 0.78, 0.95],
      "transform": { "position": [-1.7, 0.39, -0.5], "rotation": [0, -0.12, 0] },
      "provenance": { "passageId": "G1", "confidence": 0.9 }
    }
  ],
  "relations": [
    {
      "id": "grove-lantern-near-bench",
      "subjectId": "grove-lantern-1",
      "predicate": "near",
      "objectId": "grove-bench-1",
      "distance": 0.65
    },
    {
      "id": "provisions-near-bench",
      "subjectId": "traveller-crate-1",
      "predicate": "near",
      "objectId": "grove-bench-1",
      "distance": 0.8
    }
  ],
  "conflicts": []
}
